Symbol,Name,Last Sale,Net Change,% Change,Market Cap,Country,IPO Year,Volume,Sector,Industry
DFSC,DEFSEC Technologies Inc. Common Stock,$3.82,-0.07,-1.799%,5333946.00,Canada,,29827,Technology,Computer Software: Prepackaged Software
DFSCW,DEFSEC Technologies Inc. Warrant,$0.0332,-0.004,-10.753%,46358.00,Canada,,5200,Technology,Computer Software: Prepackaged Software
DG,Dollar General Corporation Common Stock,$112.77,-1.93,-1.683%,24817362802.00,United States,2009,3257500,Consumer Discretionary,Department/Specialty Retail Stores
DGICA,Donegal Group Inc. Class A Common Stock,$17.38,-0.13,-0.742%,634519972.00,United States,,435508,Finance,Property-Casualty Insurers
DGICB,Donegal Group Inc. Class B Common Stock,$15.475,1.155,8.066%,564971034.00,United States,1986,499,Finance,Property-Casualty Insurers
DGII,Digi International Inc. Common Stock,$32.24,-0.62,-1.887%,1196819148.00,United States,1989,240313,Telecommunications,Computer Communications Equipment
DGLY,Digital Ally Inc. Common Stock,$1.72,-0.02,-1.149%,2869806.00,United States,,56208,Technology,Radio And Television Broadcasting And Communications Equipment
DGNX,Diginex Limited Ordinary Shares,$52.80,-2.14,-3.895%,9712565491.00,Hong Kong,2025,20117,Technology,EDP Services
DGX,Quest Diagnostics Incorporated Common Stock,$179.77,1.33,0.745%,20102499989.00,United States,,810247,Health Care,Medical Specialities
DGXX,Digi Power X Inc. Subordinate Voting Shares,$2.24,-0.58,-20.567%,100145123.00,Canada,,1707793,Finance,Finance: Consumer Services
DH,Definitive Healthcare Corp. Class A Common Stock,$3.87,0.07,1.842%,402813633.00,United States,2021,225807,Technology,Computer Software: Prepackaged Software
DHAI,DIH Holdings US Inc. Class A Common Stock,$0.2394,0.0157,7.018%,11332311.00,United States,2024,48486767,Health Care,Medical/Dental Instruments
DHAIW,DIH Holding US Inc. Warrants,$0.02,0.0019,10.497%,946726.00,United States,2024,77022,Health Care,Medical/Dental Instruments
DHC,Diversified Healthcare Trust Common Shares of Beneficial Interest,$3.37,-0.11,-3.161%,813566383.00,United States,,512291,Real Estate,Real Estate Investment Trusts
DHCNI,Diversified Healthcare Trust 5.625% Senior Notes due 2042,$17.25,-0.38,-2.155%,4164397658.00,United States,,10999,Real Estate,Real Estate Investment Trusts
DHCNL,Diversified Healthcare Trust 6.25% Senior Notes Due 2046,$17.98,-0.0294,-0.163%,4340630139.00,United States,,51816,Real Estate,Real Estate Investment Trusts
DHF,BNY Mellon High Yield Strategies Fund Common Stock,$2.56,-0.03,-1.158%,0.00,United States,1998,449126,Finance,Finance Companies
DHI,D.R. Horton Inc. Common Stock,$165.62,1.72,1.049%,49375218873.00,United States,,5930155,Consumer Discretionary,Homebuilding
DHIL,Diamond Hill Investment Group Inc. Class A Common Stock,$143.54,-1.96,-1.347%,391169179.00,United States,,26357,Finance,Investment Managers
DHR,Danaher Corporation Common Stock,$210.93,0.71,0.338%,151036761879.00,United States,,3210213,Industrials,Industrial Machinery/Components
DHT,DHT Holdings Inc.,$11.20,-0.01,-0.089%,1798249354.00,Jersey,2005,1775269,Consumer Discretionary,Marine Transportation
DHX,DHI Group Inc. Common Stock,$2.19,-0.17,-7.203%,105142671.00,United States,2007,68890,Real Estate,Real Estate
DHY,Credit Suisse High Yield Bond Fund Common Stock,$2.09,-0.02,-0.948%,0.00,United States,1998,988058,Finance,Finance/Investors Services
DIAX,Nuveen Dow 30SM Dynamic Overwrite Fund Common Shares of Beneficial Interest,$14.44,-0.01,-0.069%,0.00,,2014,54064,Finance,Finance Companies
DIBS,1stdibs.com Inc. Common Stock,$2.57,-0.06,-2.281%,93153785.00,United States,2021,47233,Consumer Discretionary,Catalog/Specialty Distribution
DIN,Dine Brands Global Inc. Common Stock,$21.38,-0.20,-0.927%,328809926.00,United States,,436654,Consumer Discretionary,Restaurants
DINO,HF Sinclair Corporation Common Stock,$44.82,0.28,0.629%,8384950654.00,United States,1960,1440690,Energy,Natural Gas Distribution
DIOD,Diodes Incorporated Common Stock,$52.75,-1.17,-2.17%,2449854271.00,United States,,452415,Technology,Semiconductors
DIS,Walt Disney Company (The) Common Stock,$115.39,-0.92,-0.791%,207463584990.00,United States,,6766665,Consumer Discretionary,Services-Misc. Amusement & Recreation
DIT,AMCON Distributing Company Common Stock,$109.38,0.00,0.00%,70600634.00,United States,1999,26,Consumer Discretionary,Food Distributors
DJCO,Daily Journal Corp. (S.C.) Common Stock,$426.12,-3.37,-0.785%,586948767.00,United States,,59459,Consumer Discretionary,Newspapers/Magazines
DJT,Trump Media & Technology Group Corp. Common Stock,$18.50,0.88,4.994%,5125746826.00,United States,2024,8695269,Technology,Computer Software: Programming Data Processing
DJTWW,Trump Media & Technology Group Corp. Warrants,$9.91,0.36,3.77%,2745737894.00,United States,2021,25908,Technology,Computer Software: Programming Data Processing
DK,Delek US Holdings Inc. Common Stock,$21.76,0.75,3.57%,1308916376.00,United States,2017,1591076,Energy,Integrated oil Companies
DKI,DarkIris Inc. Class A Ordinary Shares,$3.76,-0.12,-3.093%,65800000.00,Hong Kong,2025,75851,Technology,Computer Software: Prepackaged Software
DKL,Delek Logistics Partners L.P. Common Units representing Limited Partner Interests,$43.43,-0.33,-0.754%,2321934093.00,United States,2012,52578,Energy,Natural Gas Distribution
DKNG,DraftKings Inc. Class A Common Stock,$44.94,1.27,2.908%,22311364991.00,United States,2019,9583008,Consumer Discretionary,Services-Misc. Amusement & Recreation
DKS,Dick's Sporting Goods Inc Common Stock,$223.97,1.16,0.521%,17928151451.00,United States,2002,1177874,Consumer Discretionary,Other Specialty Stores
DLB,Dolby Laboratories Common Stock,$72.81,0.28,0.386%,6978415110.00,United States,2005,396509,Miscellaneous,Multi-Sector Companies
DLHC,DLH Holdings Corp.,$5.57,-0.31,-5.272%,80132627.00,United States,,12142,Consumer Discretionary,Professional Services
DLNG,Dynagas LNG Partners LP Common Units,$3.54,-0.11,-3.014%,129839348.00,Greece,,83141,Consumer Discretionary,Marine Transportation
DLNG^A,Dynagas LNG Partners LP 9.00% Series A Cumulative Redeemable Preferred Units,$26.15,-0.0885,-0.337%,,Greece,,5291,,
DLO,DLocal Limited Class A Common Shares,$15.66,0.31,2.02%,4470540630.00,Uruguay,2021,5484936,Real Estate,Real Estate
DLPN,Dolphin Entertainment Inc. Common Stock,$1.18,-0.08,-6.349%,13178380.00,United States,,440373,Consumer Discretionary,Other Consumer Services
DLR,Digital Realty Trust Inc. Common Stock,$166.90,0.68,0.409%,56921317602.00,United States,2004,1949873,Real Estate,Real Estate Investment Trusts
DLR^J,Digital Realty Trust Inc. 5.250% Series J Cumulative Redeemable Preferred Stock,$21.84,0.04,0.183%,,United States,,7323,,
DLR^K,Digital Realty Trust Inc. 5.850% Series K Cumulative Redeemable Preferred Stock par value $0.01 per share,$24.39,0.07,0.288%,,United States,,11441,,
DLR^L,Digital Realty Trust Inc. 5.200% Series L Cumulative Redeemable Preferred Stock,$21.36,0.11,0.518%,,United States,,8727,,
DLTH,Duluth Holdings Inc. Class B Common Stock,$2.1435,-0.0665,-3.009%,80550286.00,United States,2015,16741,Consumer Discretionary,Clothing/Shoe/Accessory Stores
DLTR,Dollar Tree Inc. Common Stock,$113.49,-1.14,-0.995%,23684888385.00,United States,1995,3439042,Consumer Discretionary,Department/Specialty Retail Stores
DLX,Deluxe Corporation Common Stock,$19.29,-0.04,-0.207%,865836376.00,United States,,528206,Consumer Discretionary,Publishing
DLXY,Delixy Holdings Limited Ordinary Shares,$4.8662,-0.2338,-4.584%,79562370.00,Singapore,2025,6834,,
DLY,DoubleLine Yield Opportunities Fund Common Shares of Beneficial Interest,$15.37,0.02,0.13%,736926623.00,United States,2020,243865,Finance,Investment Managers
DMA,Destra Multi-Alternative Fund Common Stock,$8.63,0.01,0.116%,0.00,,2022,52659,Finance,Trusts Except Educational Religious and Charitable
DMAA,Drugs Made In America Acquisition Corp. Ordinary Shares,$10.27,-0.01,-0.097%,0.00,United States,2025,105,,
DMAAR,Drugs Made In America Acquisition Corp. Rights,$0.1799,0.0179,11.049%,0.00,United States,2025,6323,Finance,Blank Checks
DMAAU,Drugs Made In America Acquisition Corp. Units,$10.60,0.00,0.00%,0.00,United States,2025,20,,
DMAC,DiaMedica Therapeutics Inc. Common Stock,$6.03,0.02,0.333%,311684145.00,United States,2018,125551,Health Care,Biotechnology: Pharmaceutical Preparations
DMB,BNY Mellon Municipal Bond Infrastructure Fund Inc. Common Stock,$10.08,0.02,0.199%,0.00,,2013,50593,Finance,Trusts Except Educational Religious and Charitable
DMLP,Dorchester Minerals L.P. Common Units Representing Limited Partnership Interests,$24.72,-0.33,-1.317%,1170238768.00,United States,,163464,Energy,Oil & Gas Production
DMO,Western Asset Mortgage Opportunity Fund Inc. Common Stock,$11.86,-0.01,-0.084%,0.00,United States,2010,49696,Finance,Trusts Except Educational Religious and Charitable
DMRC,Digimarc Corporation Common Stock,$8.81,-2.22,-20.127%,189873129.00,United States,,1177911,Technology,EDP Services
DMYY,dMY Squared Technology Group Inc. Class A Common Stock,$12.92,0.21,1.652%,0.00,,2022,10536,Finance,Blank Checks
DNA,Ginkgo Bioworks Holdings Inc. Class A Common Stock,$13.18,0.28,2.171%,780252745.00,United States,2021,1331315,Health Care,Biotechnology: Biological Products (No Diagnostic Substances)
DNB,Dun & Bradstreet Holdings Inc. Common Stock,$9.09,0.00,0.00%,4055860046.00,United States,2020,3835473,Finance,Finance: Consumer Services
DNLI,Denali Therapeutics Inc. Common Stock,$14.70,0.24,1.66%,2149320487.00,United States,2017,1150114,Health Care,Biotechnology: Biological Products (No Diagnostic Substances)
DNN,Denison Mines Corp Ordinary Shares (Canada),$2.03,0.00,0.00%,1820002338.00,Canada,,47557019,Basic Materials,Other Metals and Minerals
DNOW,DNOW Inc. Common Stock,$14.49,-0.40,-2.686%,1521623387.00,United States,2014,1150632,Consumer Discretionary,Oil and Gas Field Machinery
DNP,DNP Select Income Fund Inc. Common Stock,$9.82,-0.03,-0.305%,0.00,United States,1987,554934,Finance,Investment Managers
DNTH,Dianthus Therapeutics Inc. Common Stock,$20.74,0.49,2.42%,667586275.00,United States,2018,280117,Health Care,Biotechnology: Pharmaceutical Preparations
DNUT,Krispy Kreme Inc. Common Stock,$3.48,-0.02,-0.571%,595776000.00,United States,2021,2407907,Consumer Staples,Food Chains
DOC,Healthpeak Properties Inc. Common Stock,$17.31,0.27,1.585%,12029124971.00,United States,,6202171,Real Estate,Real Estate Investment Trusts
DOCN,DigitalOcean Holdings Inc. Common Stock,$31.04,0.50,1.637%,2825803938.00,United States,2021,1892012,Technology,Computer Software: Programming Data Processing
DOCS,Doximity Inc. Class A Common Stock,$65.13,1.59,2.502%,12198813765.00,United States,2021,1753679,Technology,EDP Services
DOCU,DocuSign Inc. Common Stock,$70.90,1.90,2.754%,14326250535.00,United States,1989,2108242,Technology,Computer Software: Prepackaged Software
DOGZ,Dogness (International) Corporation Class A Common Stock,$15.98,1.86,13.173%,203435915.00,China,2017,475500,Consumer Discretionary,Miscellaneous manufacturing industries
DOLE,Dole plc Ordinary Shares,$14.02,-0.06,-0.426%,1333835237.00,Ireland,2021,624326,Consumer Staples,Farming/Seeds/Milling
DOMH,Dominari Holdings Inc. Common Stock,$6.40,0.18,2.894%,98038003.00,United States,,239178,Health Care,Biotechnology: Pharmaceutical Preparations
DOMO,Domo Inc. Class B Common Stock,$14.12,-0.02,-0.141%,568119160.00,United States,2018,377826,Technology,Computer Software: Prepackaged Software
DOOO,BRP Inc. (Recreational Products) Common Subordinate Voting Shares,$56.605,-0.945,-1.642%,4139638785.00,Canada,,407672,Consumer Discretionary,Industrial Specialties
DORM,Dorman Products Inc. Common Stock,$152.48,-3.34,-2.143%,4655861373.00,United States,,387241,Consumer Discretionary,Auto Parts:O.E.M.
DOUG,Douglas Elliman Inc. Common Stock,$2.46,0.06,2.50%,218221928.00,United States,2021,459040,Finance,Real Estate
DOV,Dover Corporation Common Stock,$176.54,-2.86,-1.594%,24209716333.00,United States,,620594,Industrials,Industrial Machinery/Components
DOW,Dow Inc. Common Stock ,$23.36,-0.01,-0.043%,16558599367.00,United States,2019,10776156,Industrials,Major Chemicals
DOX,Amdocs Limited Ordinary Shares,$87.36,0.01,0.011%,9862119671.00,Guernsey,,773494,Technology,EDP Services
DOYU,DouYu International Holdings Limited ADS,$7.225,-0.055,-0.755%,218042256.00,China,2019,41641,Technology,Computer Software: Programming Data Processing
DPG,Duff & Phelps Utility and Infrastructure Fund Inc.,$12.67,-0.02,-0.158%,0.00,United States,2011,85123,Finance,Trusts Except Educational Religious and Charitable
DPRO,Draganfly Inc. Common Shares,$4.26,-0.15,-3.401%,94726791.00,Canada,,1278139,Industrials,Aerospace
DPZ,Domino's Pizza Inc Common Stock,$451.26,0.67,0.149%,15319790090.00,United States,2004,559614,Consumer Discretionary,Food Distributors
DQ,DAQO New Energy Corp. American Depositary Shares each representing five ordinary shares,$22.97,1.71,8.043%,1540292744.00,China,2010,1546725,Technology,Semiconductors
DRCT,Direct Digital Holdings Inc. Class A Common Stock,$0.41,-0.0299,-6.797%,9232129.00,United States,2022,434611,Consumer Discretionary,Advertising
DRD,DRDGOLD Limited American Depositary Shares,$14.96,0.07,0.47%,1293424710.00,South Africa,,178473,Basic Materials,Precious Metals
DRDB,Roman DBDR Acquisition Corp. II Ordinary shares,$10.27,0.00,0.00%,0.00,United States,2025,2700,,
DRDBU,Roman DBDR Acquisition Corp. II Unit,$10.61,0.11,1.048%,0.00,United States,2024,4601,,
DRDBW,Roman DBDR Acquisition Corp. II Warrants,$0.46,0.01,2.222%,0.00,United States,2025,5183,,
DRH,Diamondrock Hospitality Company Common Stock,$7.90,-0.07,-0.878%,1619141261.00,United States,2005,2778005,Real Estate,Real Estate Investment Trusts
DRH^A,Diamondrock Hospitality Company 8.250% Series A Cumulative Redeemable Preferred Stock,$25.36,0.065,0.257%,,United States,,1173,,
DRI,Darden Restaurants Inc. Common Stock,$207.35,1.29,0.626%,24266964651.00,United States,,1337672,Consumer Discretionary,Restaurants
DRIO,DarioHealth Corp. Common Stock,$0.448,0.0122,2.799%,20382635.00,Israel,,89921,Health Care,Medical/Dental Instruments
DRMA,Dermata Therapeutics Inc. Common Stock,$5.98,0.17,2.926%,4075711.00,United States,2021,7416,Health Care,Biotechnology: Pharmaceutical Preparations
DRMAW,Dermata Therapeutics Inc. Warrant,$0.022,0.00,0.00%,14994.00,United States,2021,2097,Health Care,Biotechnology: Pharmaceutical Preparations
DRRX,DURECT Corporation Common Stock,$1.91,0.01,0.526%,59313497.00,United States,2000,537102,Health Care,Biotechnology: Pharmaceutical Preparations
DRS,Leonardo DRS Inc. Common Stock,$41.67,-0.07,-0.168%,11089371829.00,Israel,,878506,Industrials,Industrial Machinery/Components
DRTS,Alpha Tau Medical Ltd. Ordinary Shares,$3.28,0.08,2.50%,230848270.00,Israel,,23724,Health Care,Medical/Dental Instruments
DRTSW,Alpha Tau Medical Ltd. Warrant,$0.2726,0.00,0.00%,19185743.00,Israel,,124,Health Care,Medical/Dental Instruments
DRUG,Bright Minds Biosciences Inc. Common Stock,$41.82,-0.72,-1.693%,296221055.00,Canada,,51074,Health Care,Biotechnology: Pharmaceutical Preparations
DRVN,Driven Brands Holdings Inc. Common Stock,$16.76,-0.15,-0.887%,2753331979.00,United States,2021,737450,Consumer Discretionary,Automotive Aftermarket
DSGN,Design Therapeutics Inc. Common Stock,$5.33,0.17,3.295%,303533512.00,United States,2021,109780,Health Care,Biotechnology: Pharmaceutical Preparations
DSGR,Distribution Solutions Group Inc. Common Stock,$32.485,-0.255,-0.779%,1503246396.00,United States,,58368,Consumer Discretionary,Industrial Specialties
DSGX,Descartes Systems Group Inc. (The) Common Stock,$98.22,0.38,0.388%,8425589563.00,Canada,,305862,Technology,Computer Software: Prepackaged Software
DSL,DoubleLine Income Solutions Fund Common Shares of Beneficial Interests,$12.24,-0.02,-0.163%,1248441175.00,United States,2013,334336,Finance,Trusts Except Educational Religious and Charitable
DSM,BNY Mellon Strategic Municipal Bond Fund Inc. Common Stock,$5.62,0.02,0.357%,0.00,United States,1989,46190,Finance,Investment Managers
DSP,Viant Technology Inc. Class A Common Stock,$9.50,-0.03,-0.315%,598035764.00,United States,2021,368657,Technology,Computer Software: Programming Data Processing
DSS,DSS Inc. Common Stock,$0.835,0.0033,0.397%,7592253.00,United States,,11198,Consumer Discretionary,Containers/Packaging
DSU,Blackrock Debt Strategies Fund Inc. Common Stock,$10.51,-0.07,-0.662%,0.00,United States,1998,165281,Finance,Finance Companies
DSWL,Deswell Industries Inc. Common Shares,$3.47,0.3237,10.288%,55295279.00,Macau,1995,51493,Industrials,Plastic Products
DSX,Diana Shipping inc. common stock,$1.55,-0.02,-1.274%,179440185.00,Greece,2005,218563,Consumer Discretionary,Marine Transportation
DSX^B,Diana Shipping Inc. Perpetual Preferred Shares Series B (Marshall Islands),$25.69,-0.41,-1.571%,,Greece,,372,,
DSY,Big Tree Cloud Holdings Limited Ordinary Shares,$1.05,-0.0669,-5.99%,59934573.00,China,,9624,Consumer Discretionary,Containers/Packaging
DSYWW,Big Tree Cloud Holdings Limited Warrants,$0.02,-0.0001,-0.498%,1141611.00,China,,3536,Consumer Discretionary,Containers/Packaging
DT,Dynatrace Inc. Common Stock,$48.24,0.82,1.729%,14544661114.00,United States,2019,2827543,Technology,Computer Software: Prepackaged Software
DTB,DTE Energy Company 2020 Series G 4.375% Junior Subordinated Debentures due 2080,$17.69,-0.04,-0.226%,3672228235.00,United States,2020,10320,Utilities,Electric Utilities: Central
DTCK,Davis Commodities Limited Class A Ordinary Shares,$0.792,0.008,1.02%,19404495.00,Singapore,2023,154509,Industrials,Farming/Seeds/Milling
DTE,DTE Energy Company Common Stock,$138.92,-1.01,-0.722%,28838097593.00,United States,,1296533,Utilities,Electric Utilities: Central
DTF,DTF Tax-Free Income 2028 Term Fund Inc. Common Stock,$11.27,-0.01,-0.089%,79223220.00,United States,1991,1810,Finance,Investment Managers
DTG,DTE Energy Company 2021 Series E 4.375% Junior Subordinated Debentures,$17.52,-0.25,-1.407%,3636938309.00,United States,2021,29187,Utilities,Electric Utilities: Central
DTI,Drilling Tools International Corporation Common Stock,$2.00,-0.10,-4.762%,71185474.00,United States,2021,52257,Consumer Discretionary,Oil and Gas Field Machinery
DTIL,Precision BioSciences Inc. Common Stock,$4.71,-0.06,-1.258%,55516728.00,United States,2019,106424,Health Care,Biotechnology: Biological Products (No Diagnostic Substances)
DTM,DT Midstream Inc. Common Stock ,$103.41,-0.34,-0.328%,10505680942.00,United States,2021,495450,Utilities,Natural Gas Distribution
DTSQ,DT Cloud Star Acquisition Corporation Ordinary Shares,$10.4511,0.0111,0.106%,0.00,United States,2024,3100,,
DTSQR,DT Cloud Star Acquisition Corporation Right,$0.1235,-0.0465,-27.353%,0.00,United States,2024,3109,,
DTSS,Datasea Inc. Common Stock,$1.8161,-0.0039,-0.214%,13900195.00,China,,22096,Technology,Computer Software: Prepackaged Software
DTST,Data Storage Corporation Common Stock,$4.49,-0.04,-0.883%,32058120.00,United States,,191462,Technology,EDP Services
DTSTW,Data Storage Corporation Warrant,$0.2521,-0.0026,-1.021%,1799967.00,United States,,7654,Technology,EDP Services
DTW,DTE Energy Company 2017 Series E 5.25% Junior Subordinated Debentures due 2077,$22.6001,-0.3999,-1.739%,4691505107.00,United States,2017,8060,Utilities,Electric Utilities: Central
DUK,Duke Energy Corporation (Holding Company) Common Stock,$122.45,-1.81,-1.457%,95220115984.00,United States,,4023961,Utilities,Power Generation
DUK^A,Duke Energy Corporation Depositary Shares each representing a 1/1000th interest in a share of 5.75% Series A Cumulative Redeemable Perpetual Preferred Stock,$24.79,-0.31,-1.235%,,United States,,66687,,
DUKB,Duke Energy Corporation 5.625% Junior Subordinated Debentures due 2078,$24.43,-0.02,-0.082%,18997365729.00,United States,2018,23359,Utilities,Power Generation
DUO,Fangdd Network Group Ltd. Class A Ordinary Shares,$1.51,-0.14,-8.485%,5895893.00,China,2019,329800,Finance,Real Estate
DUOL,Duolingo Inc. Class A Common Stock,$326.93,-2.95,-0.894%,14980556056.00,United States,2021,1063976,Technology,Computer Software: Prepackaged Software
DUOT,Duos Technologies Group Inc. Common Stock,$6.25,0.06,0.969%,72836906.00,United States,,400102,Technology,Computer Software: Prepackaged Software
DV,DoubleVerify Holdings Inc. Common Stock,$15.84,0.46,2.991%,2591873523.00,United States,2021,2187419,Technology,Computer Software: Programming Data Processing
DVA,DaVita Inc. Common Stock,$135.38,0.99,0.737%,9679670000.00,United States,,721001,Health Care,Misc Health and Biotechnology Services
DVAX,Dynavax Technologies Corporation Common Stock,$10.79,0.17,1.601%,1265316131.00,United States,2004,1019772,Health Care,Biotechnology: Pharmaceutical Preparations
DVLT,Datavault AI Inc. Common Stock,$0.4589,-0.0063,-1.354%,30298501.00,United States,2018,1025012,Technology,Semiconductors
DVN,Devon Energy Corporation Common Stock,$33.69,-0.16,-0.473%,21386412000.00,United States,1985,5364885,Energy,Oil & Gas Production
DVS,Dolly Varden Silver Corporation Common Shares,$3.51,-0.07,-1.955%,305949694.00,,2025,328166,,
DWSN,Dawson Geophysical Company Common Stock,$1.29,-0.01,-0.769%,40051663.00,United States,,67508,Energy,Oil & Gas Production
DWTX,Dogwood Therapeutics Inc. Common Stock,$4.93,0.01,0.203%,9421861.00,United States,2020,11608,Health Care,Biotechnology: Pharmaceutical Preparations
DX,Dynex Capital Inc. Common Stock,$12.58,0.01,0.08%,1634294935.00,United States,,2629878,Real Estate,Real Estate Investment Trusts
DX^C,Dynex Capital Inc. 6.900% Series C Fixed-to-Floating Rate Cumulative Redeemable Preferred Stock,$25.83,0.0041,0.016%,,United States,,5325,,
DXC,DXC Technology Company Common Stock ,$13.71,-0.07,-0.508%,2494682445.00,United States,,1527978,Technology,EDP Services
DXCM,DexCom Inc. Common Stock,$80.95,0.99,1.238%,31744968702.00,United States,2005,2232908,Health Care,Medical/Dental Instruments
DXF,Eason Technology Limited American Depositary Shares (each representing sixty-thousand (60000) Ordinary Shares),$4.80,0.63,15.108%,1197427.00,,,229061,Finance,Finance: Consumer Services
DXLG,Destination XL Group Inc. Common Stock,$1.27,-0.04,-3.053%,68345055.00,United States,,109248,Consumer Discretionary,Clothing/Shoe/Accessory Stores
DXPE,DXP Enterprises Inc. Common Stock,$116.96,-1.80,-1.516%,1835580065.00,United States,,107343,Industrials,Industrial Machinery/Components
DXR,Daxor Corporation Common Stock,$10.60,-0.01,-0.094%,51304000.00,United States,,5434,Health Care,Medical/Dental Instruments
DXST,Decent Holding Inc Class A Ordinary Shares,$1.14,-0.0105,-0.913%,18525000.00,China,2025,17913,Industrials,Miscellaneous
DXYZ,Destiny Tech100 Inc. Common Stock,$28.53,0.27,0.955%,0.00,,2024,283687,,
DY,Dycom Industries Inc. Common Stock,$269.36,1.40,0.522%,7791194094.00,United States,,524248,Industrials,Water Sewer Pipeline Comm & Power Line Construction
DYAI,Dyadic International Inc. Common Stock,$0.7483,-0.0517,-6.463%,27045553.00,United States,,179577,Health Care,Biotechnology: Biological Products (No Diagnostic Substances)
DYCQ,DT Cloud Acquisition Corporation Ordinary Shares,$10.98,0.0145,0.132%,0.00,United Kingdom,2024,123334,,
DYCQR,DT Cloud Acquisition Corporation Right,$0.24,0.00,0.00%,0.00,United Kingdom,2024,20,,
DYN,Dyne Therapeutics Inc. Common Stock,$12.38,-0.12,-0.96%,1761225101.00,United States,2020,1931424,Health Care,Biotechnology: Pharmaceutical Preparations
DYNX,Dynamix Corporation Class A Ordinary Shares,$10.80,-0.10,-0.917%,0.00,United States,2024,609224,,
DYNXU,Dynamix Corporation Unit,$12.00,-0.08,-0.662%,0.00,United States,2024,607,,
DYNXW,Dynamix Corporation Warrant,$2.22,-0.0987,-4.257%,0.00,United States,2024,129934,,
E,ENI S.p.A. Common Stock,$35.21,0.02,0.057%,57823455710.00,Italy,,257116,Energy,Oil & Gas Production
EA,Electronic Arts Inc. Common Stock,$174.67,-4.34,-2.424%,43703709615.00,United States,,3428776,Technology,Computer Software: Prepackaged Software
EAD,Allspring Income Opportunities Fund Common Shares,$7.04,-0.04,-0.565%,0.00,United States,2003,81201,Finance,Finance/Investors Services
EAF,GrafTech International Ltd. Common Stock,$1.28,-0.05,-3.759%,330433847.00,United States,2018,861472,Energy,Industrial Machinery/Components
EAI,Entergy Arkansas LLC First Mortgage Bonds 4.875% Series Due September 1 2066,$21.5401,-0.0649,-0.30%,9615695987.00,United States,2016,9770,Utilities,Electric Utilities: Central
EARN,Ellington Credit Company Common Shares of Beneficial Interest,$5.62,-0.05,-0.882%,211082676.00,United States,2013,185589,Real Estate,Real Estate Investment Trusts
EAT,Brinker International Inc. Common Stock,$158.16,0.08,0.051%,7030394358.00,United States,,1290626,Consumer Discretionary,Restaurants
EB,Eventbrite Inc. Class A Common Stock,$2.62,0.02,0.769%,252830217.00,United States,2018,983921,Technology,Computer Software: Programming Data Processing
EBAY,eBay Inc. Common Stock,$100.70,2.22,2.254%,46019900000.00,United States,1998,6130705,Real Estate,Real Estate
EBC,Eastern Bankshares Inc. Common Stock,$15.77,-0.32,-1.989%,3335000364.00,United States,2020,1458084,Finance,Savings Institutions
EBF,Ennis Inc. Common Stock,$18.06,-0.17,-0.933%,465860608.00,United States,,107524,Consumer Discretionary,Office Equipment/Supplies/Services
EBMT,Eagle Bancorp Montana Inc. Common Stock,$16.55,-0.205,-1.224%,131608529.00,United States,2010,18470,Finance,Major Banks
EBON,Ebang International Holdings Inc. Class A Ordinary Shares,$4.09,0.19,4.872%,26764706.00,China,2020,60567,Technology,Semiconductors
EBR,Centrais Electricas Brasileiras S A American Depositary Shares (Each representing one Common Share),$8.19,0.02,0.245%,18369177290.00,Brazil,2016,889100,Utilities,Electric Utilities: Central
EBS,Emergent BioSolutions Inc. Common Stock,$8.84,0.02,0.227%,471623715.00,United States,2006,1117257,Health Care,Biotechnology: Pharmaceutical Preparations
EC,Ecopetrol S.A. American Depositary Shares,$8.91,0.19,2.179%,18317487489.00,Colombia,,2090904,Energy,Oil & Gas Production
