Symbol,Name,Last Sale,Net Change,% Change,Market Cap,Country,IPO Year,Volume,Sector,Industry
PROK,ProKidney Corp. Class A Ordinary Shares,$2.36,-0.06,-2.479%,694506608.00,United States,2021,2035665,Health Care,Biotechnology: Biological Products (No Diagnostic Substances)
PROP,Prairie Operating Co. Common Stock,$2.75,0.23,9.127%,138263796.00,United States,,2534649,Finance,Finance: Consumer Services
PROV,Provident Financial Holdings Inc. Common Stock,$15.296,-0.264,-1.697%,101277110.00,United States,,5600,Finance,Savings Institutions
PRPH,ProPhase Labs Inc. Common Stock (DE),$0.3493,0.0168,5.053%,14510343.00,United States,,3558491,Health Care,Biotechnology: Pharmaceutical Preparations
PRPL,Purple Innovation Inc. Common Stock,$1.12,0.08,7.692%,121417999.00,United States,2015,1917312,Consumer Discretionary,Home Furnishings
PRPO,Precipio Inc.  Common Stock,$14.70,-0.01,-0.068%,23807885.00,United States,,54258,Industrials,Biotechnology: Laboratory Analytical Instruments
PRQR,ProQR Therapeutics N.V. Ordinary Shares,$2.05,0.03,1.485%,215685680.00,Netherlands,2014,124827,Health Care,Biotechnology: Pharmaceutical Preparations
PRS,Prudential Financial Inc. 5.625% Junior Subordinated Notes due 2058,$24.38,-0.06,-0.245%,8581760000.00,United States,2018,31820,Finance,Life Insurance
PRSO,Peraso Inc. Common Stock,$0.8849,-0.0041,-0.461%,5460753.00,United States,,55868,Technology,Semiconductors
PRSU,Pursuit Attractions and Hospitality Inc. Common Stock,$34.32,0.23,0.675%,970386709.00,United States,,378059,Real Estate,Real Estate
PRT,PermRock Royalty Trust Trust Units,$3.98,0.02,0.505%,48419613.00,United States,2018,28087,Energy,Oil & Gas Production
PRTA,Prothena Corporation plc Ordinary Shares,$8.25,0.19,2.357%,444097352.00,United States,,1130312,Health Care,Biotechnology: Pharmaceutical Preparations
PRTC,PureTech Health plc American Depositary Shares,$18.01,0.51,2.914%,434610710.00,United States,,2412,Health Care,Biotechnology: Pharmaceutical Preparations
PRTG,Portage Biotech Inc. Common Stock,$8.68,-0.12,-1.364%,19778439.00,Canada,,15155,Energy,Oil & Gas Production
PRTH,Priority Technology Holdings Inc. Common Stock,$7.62,-0.13,-1.677%,608974589.00,United States,2016,450957,Real Estate,Real Estate
PRTS,CarParts.com Inc. Common Stock,$0.7366,-0.0236,-3.104%,43432365.00,United States,2007,1014578,Consumer Discretionary,Auto & Home Supply Stores
PRU,Prudential Financial Inc. Common Stock,$105.92,-0.90,-0.843%,37283840000.00,United States,2001,1188024,Finance,Life Insurance
PRVA,Privia Health Group Inc. Common Stock,$21.27,0.56,2.704%,2610465505.00,United States,2021,816110,Health Care,Medical/Nursing Services
PRZO,ParaZero Technologies Ltd. Ordinary Shares,$1.53,-0.06,-3.774%,25519835.00,Israel,2023,522468,Industrials,Military/Government/Technical
PSA,Public Storage Common Stock,$282.94,2.05,0.73%,49642628813.00,United States,,577248,Real Estate,Real Estate Investment Trusts
PSA^F,Public Storage Depositary Shares Each Representing 1/1000 of a 5.15% Cumulative Preferred Share of Beneficial Interest Series F par value $0.01 per share,$21.6882,0.0581,0.269%,,United States,,6352,,
PSA^G,Public Storage Depositary Shares Each Representing 1/1000 of a 5.05% Cumulative Preferred Share of Beneficial Interest Series G,$21.10,-0.07,-0.331%,,United States,,21531,,
PSA^H,Public Storage Depositary Shares Each Representing 1/1000 of a  5.60% Cumulative Preferred  Share of Beneficial Interest Series H,$23.87,0.00,0.00%,,United States,,10031,,
PSA^I,Public Storage Depositary Shares Each Representing 1/1000 of a 4.875% Cumulative Preferred Share of Beneficial Interest Series I par value $0.01 per share,$19.9211,-0.0189,-0.095%,,United States,,10356,,
PSA^J,Public Storage Depositary Shares Each Representing 1/1000 of a 4.700% Cumulative Preferred Share of Beneficial Interest Series J par value $0.01 per share,$19.25,-0.01,-0.052%,,United States,,1316,,
PSA^K,Public Storage Depositary Shares Each Representing 1/1000 of a 4.75% Cumulative Preferred Share of Beneficial Interest Series K,$19.37,-0.0356,-0.183%,,United States,,31298,,
PSA^L,Public Storage Depositary Shares Each Representing 1/1000 of a 4.625% Cumulative Preferred Share of Beneficial Interest Series L par value $0.01 per share,$18.97,-0.0792,-0.416%,,United States,,22187,,
PSA^M,Public Storage Depositary Shares Each Representing 1/1000 of a 4.125% Cumulative Preferred Share of Beneficial Interest Series M,$16.84,-0.0601,-0.356%,,United States,,8648,,
PSA^N,Public Storage Depositary Shares Each Representing 1/1000 of a 3.875% Cumulative Preferred Share of Beneficial Interest Series N,$15.77,-0.12,-0.755%,,United States,,38865,,
PSA^O,Public Storage Depositary Shares Each Representing 1/1000 of a 3.900% Cumulative Preferred Share of Beneficial Interest Series O,$15.95,-0.03,-0.188%,,United States,,7486,,
PSA^P,Public Storage Depositary Shares Each Representing 1/1000 of a 4.000% Cumulative Preferred Share of Bene cial Interest Series P,$16.33,-0.03,-0.183%,,United States,,36972,,
PSA^Q,Public Storage Depositary Shares Each Representing 1/1000 of a 3.950% Cumulative Preferred Share of Beneficial Interest Series Q par value $0.01 per share,$16.10,-0.07,-0.433%,,United States,,18854,,
PSA^R,Public Storage Depositary Shares Each Representing 1/1000 of a 4.00% Cumulative Preferred Share of Bene cial Interest Series R,$16.2899,-0.007,-0.043%,,United States,,14902,,
PSA^S,Public Storage Depositary Shares Each Representing 1/1000 of a 4.100% Cumulative Preferred Share of Beneficial Interest Series S,$16.73,-0.0395,-0.236%,,United States,,4691,,
PSBD,Palmer Square Capital BDC Inc. Common Stock,$13.76,-0.14,-1.007%,0.00,,2024,147412,,
PSEC,Prospect Capital Corporation Common Stock,$2.85,0.00,0.00%,1286874043.00,United States,2004,1761293,Finance,Finance: Consumer Services
PSEC^A,Prospect Capital Corporation 5.35% Series A Fixed Rate Cumulative Perpetual Preferred Stock,$17.2565,-0.0385,-0.223%,,United States,,5921,,
PSF,Cohen & Steers Select Preferred and Income Fund Inc. Common Stock,$20.44,0.015,0.073%,1004393556.00,,2010,12891,Finance,Investment Managers
PSFE,Paysafe Limited Common Shares,$13.70,-0.10,-0.725%,820469765.00,,2021,326533,Real Estate,Real Estate
PSHG,Performance Shipping Inc. Common Shares,$1.86,-0.01,-0.535%,23123814.00,Greece,,46393,Consumer Discretionary,Marine Transportation
PSIG,PS International Group Ltd. Ordinary Shares,$0.38,0.00,0.00%,9871236.00,Hong Kong,,7459,Industrials,Integrated Freight & Logistics
PSIX,Power Solutions International Inc. Common Stock,$85.67,4.46,5.492%,1972966907.00,United States,,865344,Industrials,Industrial Machinery/Components
PSKY,Paramount Skydance Corporation Class B Common Stock,$13.72,-0.66,-4.59%,9250365408.00,United States,,16690947,Industrials,Broadcasting
PSMT,PriceSmart Inc. Common Stock,$108.95,-2.79,-2.497%,3350636424.00,United States,,246365,Consumer Discretionary,Department/Specialty Retail Stores
PSN,Parsons Corporation Common Stock,$79.55,-0.09,-0.113%,8495449574.00,United States,2019,1175153,Technology,EDP Services
PSNL,Personalis Inc. Common Stock,$4.60,-0.06,-1.288%,407914485.00,United States,2019,1044229,Health Care,Medical Specialities
PSNY,Polestar Automotive Holding UK PLC Class A ADS,$1.08,0.01,0.935%,2279182938.00,Sweden,,1462959,Industrials,Auto Manufacturing
PSNYW,Polestar Automotive Holding UK PLC Class C-1 ADS (ADW),$0.1598,0.0045,2.898%,337234661.00,Sweden,,61676,Industrials,Auto Manufacturing
PSO,Pearson Plc Common Stock,$14.45,-0.10,-0.687%,9527169622.00,United Kingdom,,450636,Consumer Discretionary,Books
PSQH,PSQ Holdings Inc. Class A Common Stock,$1.56,-0.08,-4.878%,71623040.00,,2021,1071041,Consumer Discretionary,Advertising
PSTG,Pure Storage Inc. Class A Common Stock,$58.62,0.77,1.331%,19158872964.00,United States,2015,2068508,Technology,Electronic Components
PSTL,Postal Realty Trust Inc. Class A Common Stock,$14.56,0.06,0.414%,357887799.00,United States,2019,106722,Real Estate,Real Estate Investment Trusts
PSTV,PLUS THERAPEUTICS Inc. Common Stock ,$0.6279,0.0857,15.806%,20543038.00,United States,,13156363,Health Care,Medical/Dental Instruments
PSX,Phillips 66 Common Stock,$123.61,0.88,0.717%,49953800397.00,United States,,2302961,Energy,Integrated oil Companies
PT,Pintec Technology Holdings Limited American Depositary Shares,$0.9515,0.029,3.144%,15174484.00,China,2018,778,Technology,Computer Software: Programming Data Processing
PTA,Cohen & Steers Tax-Advantaged Preferred Securities and Income Fund Common Shares of Beneficial Interest,$19.94,0.12,0.605%,1102152733.00,United States,2020,84122,Finance,Trusts Except Educational Religious and Charitable
PTC,PTC Inc. Common Stock,$205.84,-2.17,-1.043%,24658130191.00,United States,,1366154,Technology,Computer Software: Prepackaged Software
PTCT,PTC Therapeutics Inc. Common Stock,$48.82,0.12,0.246%,3878167749.00,United States,2013,1385117,Health Care,Biotechnology: Pharmaceutical Preparations
PTEN,Patterson-UTI Energy Inc. Common Stock,$5.38,-0.23,-4.10%,2072201161.00,United States,1993,7629497,Energy,Oil & Gas Production
PTGX,Protagonist Therapeutics Inc. Common Stock,$56.07,1.08,1.964%,3488188600.00,United States,2016,471864,Health Care,Biotechnology: Pharmaceutical Preparations
PTHL,Pheton Holdings Ltd Class A Ordinary Shares,$0.6327,-0.0344,-5.157%,9015975.00,China,2024,402130,Health Care,Biotechnology: Electromedical & Electrotherapeutic Apparatus
PTHS,Pelthos Therapeutics Inc. Common Stock,$20.96,2.00,10.549%,63763317.00,,2024,25223,Health Care,Biotechnology: Biological Products (No Diagnostic Substances)
PTIX,Protagenic Therapeutics Inc. Common Stock,$2.93,-0.14,-4.56%,1725662.00,United States,,67838,Health Care,Biotechnology: Pharmaceutical Preparations
PTIXW,Protagenic Therapeutics Inc. Warrant,$0.047,0.0123,35.447%,27681.00,United States,,18912,Health Care,Biotechnology: Pharmaceutical Preparations
PTLE,PTL LTD Class A Ordinary Shares,$0.1887,-0.0098,-4.937%,7073891.00,Singapore,2024,269550,Energy,Oil Refining/Marketing
PTLO,Portillo's Inc. Class A Common Stock,$7.63,-0.07,-0.909%,574904591.00,United States,2021,3903832,Consumer Discretionary,Restaurants
PTMN,Portman Ridge Finance Corporation Common Stock,$12.70,0.20,1.60%,167537498.00,United States,2006,142604,Finance,Finance: Consumer Services
PTNM,Pitanium Limited Class A Ordinary shares,$1.11,0.02,1.835%,25252500.00,Hong Kong,2025,41405,Consumer Discretionary,Package Goods/Cosmetics
PTON,Peloton Interactive Inc. Class A Common Stock,$8.52,0.03,0.353%,3474145352.00,United States,2019,9377640,Consumer Discretionary,Recreational Games/Products/Toys
PTY,Pimco Corporate & Income Opportunity Fund,$13.95,-0.03,-0.215%,0.00,United States,2002,502245,Finance,Investment Managers
PUBM,PubMatic Inc. Class A Common Stock,$8.37,0.09,1.087%,382701778.00,United States,2020,897691,Technology,Computer Software: Programming Data Processing
PUK,Prudential Public Limited Company Common Stock,$26.66,-0.30,-1.113%,34336135793.00,United Kingdom,,632139,Finance,Life Insurance
PULM,Pulmatrix Inc. Common Stock,$4.71,-0.31,-6.175%,17202262.00,United States,2014,14007,Health Care,Biotechnology: Pharmaceutical Preparations
PUMP,ProPetro Holding Corp. Common Stock,$4.79,-0.03,-0.622%,498004421.00,United States,2017,1335950,Energy,Oilfield Services/Equipment
PVBC,Provident Bancorp Inc. (MD) Common Stock,$12.50,-0.13,-1.029%,222350475.00,United States,2015,27975,Finance,Banks
PVH,PVH Corp. Common Stock,$76.89,0.78,1.025%,3696342197.00,United States,,768561,Industrials,Garments and Clothing
PVL,Permianville Royalty Trust Trust Units ,$1.82,-0.04,-2.151%,60060000.00,United States,2011,39208,Energy,Oil & Gas Production
PVLA,Palvella Therapeutics Inc. Common Stock,$47.30,1.20,2.603%,522932955.00,United States,,190653,Health Care,Biotechnology: Pharmaceutical Preparations
PW,Power REIT (MD) Common Stock,$1.20,-0.45,-27.273%,4067593.00,United States,1998,277638,Real Estate,Real Estate Investment Trusts
PW^A,Power REIT 7.75% Series A Cumulative Perpetual Preferred Stock,$4.29,0.00,0.00%,,United States,,139,,
PWM,Prestige Wealth Inc. Class A Ordinary Shares,$0.38,0.005,1.333%,12023944.00,Hong Kong,2023,58919,Finance,Finance: Consumer Services
PWP,Perella Weinberg Partners Class A Common Stock,$21.81,-0.54,-2.416%,1907920545.00,United States,2020,673304,Finance,Finance: Consumer Services
PWR,Quanta Services Inc. Common Stock,$380.81,3.30,0.874%,56742953154.00,United States,,1436427,Industrials,Engineering & Construction
PX,P10 Inc. Class A Common Stock,$12.53,-0.22,-1.725%,1376749626.00,United States,2021,393432,Finance,Investment Managers
PXLW,Pixelworks Inc.  Common Stock,$9.54,-0.08,-0.832%,50898924.00,United States,2000,32570,Technology,Semiconductors
PXS,Pyxis Tankers Inc. Common Stock,$2.54,0.04,1.60%,26634097.00,Greece,,8239,Consumer Discretionary,Marine Transportation
PXSAW,Pyxis Tankers Inc. Warrant,$0.008,-0.003,-27.273%,83887.00,Greece,,3200,Consumer Discretionary,Marine Transportation
PYPD,PolyPid Ltd. Ordinary Shares,$3.45,0.02,0.583%,35158619.00,Israel,2020,62483,Health Care,Biotechnology: Pharmaceutical Preparations
PYPL,PayPal Holdings Inc. Common Stock,$69.23,-0.15,-0.216%,66140846978.00,United States,,8124283,Real Estate,Real Estate
PYT,PPlus Tr GSC-2 Tr Ctf Fltg Rate,$23.5399,0.3572,1.541%,0.00,United States,,241,Finance,Finance: Consumer Services
PYXS,Pyxis Oncology Inc. Common Stock,$1.23,0.10,8.85%,76195628.00,United States,2021,673315,Health Care,Biotechnology: Pharmaceutical Preparations
PZG,Paramount Gold Nevada Corp. Common Stock,$0.7106,0.0246,3.586%,50771766.00,United States,2015,457765,Basic Materials,Metal Mining
PZZA,Papa John's International Inc. Common Stock,$47.57,-0.03,-0.063%,1558295301.00,United States,1993,1269748,Consumer Discretionary,Restaurants
QBTS,D-Wave Quantum Inc. Common Shares,$17.01,-1.17,-6.436%,5817732116.00,,2022,45427513,Technology,EDP Services
QCOM,QUALCOMM Incorporated Common Stock,$157.85,-0.24,-0.152%,170320150000.00,United States,1991,7580649,Technology,Radio And Television Broadcasting And Communications Equipment
QCRH,QCR Holdings Inc. Common Stock,$74.78,-1.33,-1.747%,1266920292.00,United States,,207095,Finance,Major Banks
QD,Qudian Inc. American Depositary Shares each representing one Class A Ordinary Share,$4.67,0.43,10.142%,771140718.00,China,2017,948741,Finance,Finance: Consumer Services
QDEL,QuidelOrtho Corporation Common Stock,$25.93,-0.02,-0.077%,1760659083.00,United States,,975491,Health Care,Biotechnology: In Vitro & In Vivo Diagnostic Substances
QETAR,Quetta Acquisition Corporation Right,$1.65,-0.25,-13.158%,0.00,United States,2023,5761,Finance,Blank Checks
QFIN,Qfin Holdings Inc. American Depositary Shares,$31.95,-1.35,-4.054%,4300470000.00,China,2018,2485069,Finance,Finance: Consumer Services
QGEN,Qiagen N.V. Common Shares,$49.35,0.39,0.797%,10665329634.00,Netherlands,,893019,Health Care,Biotechnology: Biological Products (No Diagnostic Substances)
QH,Quhuo Limited American Depository Shares,$0.1128,-0.0011,-0.966%,10117598.00,China,2020,5308534,Real Estate,Real Estate
QIPT,Quipt Home Medical Corp. Common Shares,$2.04,0.05,2.513%,88625703.00,United States,,184115,Health Care,Misc Health and Biotechnology Services
QLGN,Qualigen Therapeutics Inc. Common Stock,$1.90,0.14,7.955%,3107403.00,United States,2015,99324,Health Care,Biotechnology: Pharmaceutical Preparations
QLYS,Qualys Inc. Common Stock,$129.15,-0.01,-0.008%,4661782773.00,United States,2012,232702,Technology,Computer Software: Prepackaged Software
QMCO,Quantum Corporation Common Stock,$7.55,-0.32,-4.066%,44048202.00,United States,,465241,Technology,Electronic Components
QMMM,QMMM Holdings Limited Class A Ordinary Shares,$2.81,0.04,1.444%,48349821.00,Hong Kong,2024,4986359,Consumer Discretionary,Advertising
QNCX,Quince Therapeutics Inc. Common Stock,$1.69,0.01,0.595%,90776319.00,United States,2019,165427,Health Care,Biotechnology: Biological Products (No Diagnostic Substances)
QNRX,Quoin Pharmaceuticals Ltd. American Depositary Shares,$7.48,0.175,2.396%,4399489.00,Israel,2016,4358,Health Care,Medical/Dental Instruments
QNST,QuinStreet Inc. Common Stock,$14.74,-0.20,-1.339%,839471375.00,United States,2010,717468,Real Estate,Real Estate
QNTM,Quantum Biopharma Ltd. Class B Subordinate Voting Shares,$22.45,0.10,0.447%,85665496.00,Canada,,121271,Health Care,Biotechnology: Pharmaceutical Preparations
QQQX,Nuveen NASDAQ 100 Dynamic Overwrite Fund Shares of Beneficial Interest,$27.00,-0.12,-0.442%,0.00,United States,,60805,Finance,Finance Companies
QRHC,Quest Resource Holding Corporation Common Stock,$1.67,-0.01,-0.595%,34589381.00,United States,,32421,Utilities,Environmental Services
QRVO,Qorvo Inc. Common Stock,$89.35,-1.31,-1.445%,8278658488.00,United States,,1268208,Technology,Semiconductors
QS,QuantumScape Corporation Class A Common Stock,$9.03,-0.06,-0.66%,5111179897.00,United States,2020,14420989,Miscellaneous,Industrial Machinery/Components
QSEA,Quartzsea Acquisition Corporation Ordinary Shares,$10.10,0.00,0.00%,0.00,United States,2025,7,Finance,Blank Checks
QSEAR,Quartzsea Acquisition Corporation Rights,$0.29,0.005,1.754%,0.00,United States,2025,183,Finance,Blank Checks
QSEAU,Quartzsea Acquisition Corporation Units,$10.33,0.00,0.00%,0.00,United States,2025,7,Finance,Blank Checks
QSG,QuantaSing Group Limited American Depositary Shares,$7.50,0.43,6.082%,383347523.00,China,2023,434179,Real Estate,Other Consumer Services
QSI,Quantum-Si Incorporated Class A Common Stock,$1.10,-0.02,-1.786%,222744718.00,United States,2020,5770800,Industrials,Industrial Machinery/Components
QSIAW,Quantum-Si Incorporated Warrant,$0.3542,0.0142,4.176%,71723799.00,United States,2020,14180,Industrials,Industrial Machinery/Components
QSR,Restaurant Brands International Inc. Common Shares,$65.29,0.11,0.169%,29692911214.00,Canada,2014,1687402,Consumer Discretionary,Restaurants
QTRX,Quanterix Corporation Common Stock,$4.57,0.03,0.661%,212349232.00,United States,2017,444672,Industrials,Biotechnology: Laboratory Analytical Instruments
QTTB,Q32 Bio Inc. Common Stock,$1.97,0.09,4.787%,24029302.00,United States,2018,115764,Health Care,Biotechnology: Pharmaceutical Preparations
QTWO,Q2 Holdings Inc. Common Stock,$74.56,-0.24,-0.321%,4655706164.00,United States,2014,737583,Technology,Computer Software: Prepackaged Software
QUAD,Quad Graphics Inc Class A Common Stock,$6.22,-0.23,-3.566%,313942900.00,United States,,306776,Consumer Discretionary,Publishing
QUBT,Quantum Computing Inc. Common Stock,$15.32,-0.06,-0.39%,2158642172.00,United States,,15964748,Technology,Computer Software: Prepackaged Software
QUIK,QuickLogic Corporation Common Stock,$5.62,-0.91,-13.936%,92319448.00,United States,1999,579847,Technology,Semiconductors
QUMSU,Quantumsphere Acquisition Corp. Units,$10.04,-0.01,-0.10%,0.00,United States,2025,3782,,
QURE,uniQure N.V. Ordinary Shares,$16.18,0.40,2.535%,887746927.00,Netherlands,2014,1360840,Health Care,Biotechnology: Pharmaceutical Preparations
QVCC,QVC Inc. 6.250% Senior Secured Notes due 2068,$9.83,0.1609,1.664%,0.00,United States,2019,41131,Consumer Discretionary,Catalog/Specialty Distribution
QVCD,QVC Inc. 6.375% Senior Secured Notes due 2067,$10.00,0.27,2.775%,0.00,United States,2018,36192,Consumer Discretionary,Catalog/Specialty Distribution
QVCGA,QVC Group Inc. Series A Common Stock,$4.17,-0.26,-5.869%,33644048.00,United States,,90052,Consumer Discretionary,Catalog/Specialty Distribution
QVCGP,QVC Group Inc. 8.0% Fixed Rate Cumulative Redeemable Preferred Stock,$5.25,0.02,0.382%,42357614.00,United States,,51239,Consumer Discretionary,Catalog/Specialty Distribution
QXO,QXO Inc. Common Stock,$20.50,-0.52,-2.474%,11854442873.00,United States,,9674323,Consumer Discretionary,RETAIL: Building Materials
QXO^B,QXO Inc.  Depositary Shares each representing a 1/20th interest in a share of 5.50% Series B Mandatory Convertible Preferred Stock,$58.2364,-1.4836,-2.484%,,United States,,1188,,
R,Ryder System Inc. Common Stock,$180.02,-2.09,-1.148%,7343130293.00,United States,,216125,Consumer Discretionary,Rental/Leasing Companies
RA,Brookfield Real Assets Income Fund Inc. Common Stock,$13.13,-0.02,-0.152%,0.00,United States,2016,88669,Finance,Investment Managers
RAAQ,Real Asset Acquisition Corp. Class A Ordinary Share,$9.62,-0.50,-4.941%,0.00,United States,2025,31350,,
RAAQU,Real Asset Acquisition Corp. Unit,$10.36,0.00,0.00%,0.00,United States,2025,1500,Finance,Blank Checks
RAC,Rithm Acquisition Corp. Class A Ordinary Shares,$10.19,-0.0208,-0.204%,0.00,,2025,100032,,
RAC/WS,Rithm Acquisition Corp.,$0.5978,0.00,0.00%,,,,76,,
RACE,Ferrari N.V. Common Shares,$460.55,-3.88,-0.835%,111626821302.00,Italy,2015,314075,Industrials,Auto Manufacturing
RADX,Radiopharm Theranostics Limited American Depositary Shares,$4.89,-0.125,-2.493%,10625778097.00,Australia,,6475,,
RAIL,FreightCar America Inc. Common Stock,$8.58,-0.44,-4.878%,164113195.00,United States,2005,232553,Industrials,Railroads
RAIN,Rain Enhancement Technologies Holdco Inc. Class A Common Stock,$3.25,0.00,0.00%,24656167.00,United States,,355,Technology,Industrial Machinery/Components
RAINW,Rain Enhancement Technologies Holdco Inc. Warrants,$0.14,0.00,0.00%,1062112.00,United States,,4128,Technology,Industrial Machinery/Components
RAL,Ralliant Corporation Common Stock,$43.50,-0.09,-0.206%,4904154809.00,United States,2025,1329021,Industrials,Industrial Machinery/Components
RAMP,LiveRamp Holdings Inc. Common Stock,$26.63,0.83,3.217%,1747072281.00,United States,2018,918630,Technology,EDP Services
RAND,Rand Capital Corporation Common Stock,$15.21,0.005,0.033%,45170871.00,United States,,8612,Finance,Finance: Consumer Services
RANG,Range Capital Acquisition Corp. Ordinary Shares,$10.24,-0.01,-0.098%,0.00,United States,2025,115,,
RANGR,Range Capital Acquisition Corp. Rights,$0.15,0.00,0.00%,0.00,United States,2025,26,,
RANI,Rani Therapeutics Holdings Inc. Class A Common Stock,$0.55,-0.0068,-1.221%,39527723.00,United States,2021,537878,Health Care,Biotechnology: Pharmaceutical Preparations
RAPP,Rapport Therapeutics Inc. Common Stock,$14.705,-0.235,-1.573%,536701914.00,United States,2024,146288,Health Care,Biotechnology: Pharmaceutical Preparations
RAPT,RAPT Therapeutics Inc. Common Stock,$11.74,0.49,4.356%,194153702.00,United States,2019,181585,Health Care,Biotechnology: Pharmaceutical Preparations
RARE,Ultragenyx Pharmaceutical Inc. Common Stock,$29.69,0.68,2.344%,2861274081.00,United States,2014,1350280,Health Care,Biotechnology: Pharmaceutical Preparations
RAVE,Rave Restaurant Group Inc. Common Stock,$2.81,0.03,1.079%,39934500.00,United States,,3993,Consumer Discretionary,Food Distributors
RAY,Raytech Holding Limited Ordinary Shares,$2.92,0.10,3.546%,127306402.00,Hong Kong,2024,6701024,Consumer Discretionary,Consumer Electronics/Appliances
RAYA,Erayak Power Solution Group Inc. Class A Ordinary Shares,$0.0542,-0.0022,-3.901%,2741882.00,China,2022,23308751,Consumer Discretionary,Metal Fabrications
RBA,RB Global Inc. Common Stock,$114.90,-2.53,-2.154%,21445985267.00,Canada,,1221840,Real Estate,Real Estate
RBB,RBB Bancorp Common Stock,$19.35,-0.41,-2.075%,333803502.00,United States,2017,91987,Finance,Major Banks
RBBN,Ribbon Communications Inc. Common Stock,$3.87,-0.08,-2.025%,685306748.00,United States,,492722,Technology,EDP Services
RBC,RBC Bearings Incorporated Common Stock,$394.75,-7.17,-1.784%,12459335561.00,United States,2022,141298,Industrials,Metal Fabrications
RBCAA,Republic Bancorp Inc. Class A Common Stock,$71.54,-1.02,-1.406%,1397213687.00,United States,1998,32866,Finance,Major Banks
RBKB,Rhinebeck Bancorp Inc. Common Stock,$12.83,0.03,0.234%,142481384.00,United States,2019,7640,Finance,Banks
RBLX,Roblox Corporation Class A Common Stock,$117.34,-7.94,-6.338%,81345561794.00,United States,2021,18715383,Technology,Computer Software: Prepackaged Software
RBNE,Robin Energy Ltd. Common Stock,$1.98,0.02,1.02%,4725729.00,Cyprus,,137105,Consumer Discretionary,Marine Transportation
RBOT,Vicarious Surgical Inc. Class A Common Stock,$6.86,-0.60,-8.043%,40832387.00,Hong Kong,2020,37990,Health Care,Industrial Specialties
RBRK,Rubrik Inc. Class A Common Stock,$85.83,1.38,1.634%,16607534231.00,United States,2024,2337632,Technology,Computer Software: Prepackaged Software
RC,Ready Capital Corporation Common Stock,$3.82,-0.04,-1.036%,627730179.00,United States,2013,1486682,Real Estate,Real Estate Investment Trusts
RC^C,Ready Capital Corporation 6.25% Series C Cumulative Convertible Preferred Stock,$15.48,0.00,0.00%,,United States,,3,,
RC^E,Ready Capital Corporation 6.50% Series E Cumulative Redeemable Preferred Stock,$15.43,-0.01,-0.065%,,United States,,11339,,
RCAT,Red Cat Holdings Inc. Common Stock,$8.41,-0.96,-10.245%,764597379.00,United States,,18104039,Technology,Computer Software: Prepackaged Software
RCB,Ready Capital Corporation 6.20% Senior Notes due 2026,$24.27,-0.01,-0.041%,3988222891.00,United States,2019,1419,Real Estate,Real Estate Investment Trusts
RCC,Ready Capital Corporation 5.75% Senior Notes due 2026,$24.56,-0.05,-0.203%,4035877800.00,United States,2021,2040,Real Estate,Real Estate Investment Trusts
RCD,Ready Capital Corporation 9.00% Senior Notes due 2029,$23.90,0.33,1.40%,0.00,United States,2024,22934,Real Estate,Real Estate Investment Trusts
RCEL,Avita Medical Inc. Common Stock,$5.63,-0.17,-2.931%,149864598.00,United States,,545616,Health Care,Medical/Dental Instruments
RCG,RENN Fund Inc Common Stock,$2.66,-0.01,-0.375%,0.00,United States,,3758,Finance,Investment Managers
RCI,Rogers Communication Inc. Common Stock,$35.32,0.26,0.742%,19080756819.00,Canada,,1007886,Telecommunications,Cable & Other Pay Television Services
RCKT,Rocket Pharmaceuticals Inc. Common Stock,$3.05,0.02,0.66%,329106807.00,United States,2015,1429133,Health Care,Biotechnology: Pharmaceutical Preparations
