Symbol,Name,Last Sale,Net Change,% Change,Market Cap,Country,IPO Year,Volume,Sector,Industry
JXG,JX Luxventure Group Inc. Common Stock,$0.9988,0.026,2.673%,4036103.00,China,2013,99670,Consumer Staples,Apparel
JXN,Jackson Financial Inc. Class A Common Stock ,$94.44,-2.01,-2.084%,6577883599.00,United States,2021,418297,Finance,Life Insurance
JXN^A,Jackson Financial Inc. Depositary Shares each representing a 1/1000th interest in a share of Fixed-Rate Reset Noncumulative Perpetual Preferred Stock Series A,$25.98,-0.235,-0.896%,,United States,,44485,,
JYD,Jayud Global Logistics Limited Class A Ordinary Shares,$0.1878,-0.0002,-0.106%,17622456.00,China,2023,326871,Industrials,Integrated Freight & Logistics
JYNT,The Joint Corp. Common Stock,$10.89,0.12,1.114%,167089376.00,United States,2014,49598,Miscellaneous,Multi-Sector Companies
JZ,Jianzhi Education Technology Group Company Limited American Depositary Shs,$1.70,-0.14,-7.609%,4791450.00,China,2022,20860,Real Estate,Other Consumer Services
JZXN,Jiuzi Holdings Inc. Ordinary Shares,$0.9299,-0.1151,-11.014%,10239491.00,China,2021,263767,Consumer Discretionary,Retail-Auto Dealers and Gas Stations
K,Kellanova Common Stock,$80.19,0.11,0.137%,27879593148.00,United States,,1978321,Consumer Staples,Packaged Foods
KAI,Kadant Inc Common Stock,$339.61,-1.09,-0.32%,3999745568.00,United States,1992,110382,Industrials,Industrial Machinery/Components
KALA,KALA BIO Inc. Common Stock,$8.32,0.25,3.098%,58415053.00,United States,2017,134983,Health Care,Biotechnology: Pharmaceutical Preparations
KALU,Kaiser Aluminum Corporation Common Stock,$75.30,-0.24,-0.318%,1218200087.00,United States,,107858,Industrials,Metal Fabrications
KALV,KalVista Pharmaceuticals Inc. Common Stock,$12.88,-0.07,-0.541%,643404158.00,United Kingdom,2015,732267,Health Care,Biotechnology: Pharmaceutical Preparations
KAPA,Kairos Pharma Ltd. Common Stock,$1.20,-0.04,-3.226%,24892518.00,,2024,1462758,Health Care,Biotechnology: Pharmaceutical Preparations
KAR,OPENLANE Inc. Common Stock,$28.38,0.04,0.141%,3016897218.00,United States,2009,1000420,Consumer Discretionary,Retail-Auto Dealers and Gas Stations
KARO,Karooooo Ltd. Ordinary Shares,$47.16,0.51,1.093%,1456928028.00,Singapore,2021,91427,Technology,Computer Software: Prepackaged Software
KAVL,Kaival Brands Innovations Group Inc. Common Stock,$0.8298,0.1408,20.435%,9577802.00,United States,,840350,Consumer Discretionary,Other Consumer Services
KB,KB Financial Group Inc,$81.88,0.00,0.00%,30590426872.00,South Korea,,128588,Finance,Commercial Banks
KBDC,Kayne Anderson BDC Inc. Common Stock,$15.03,-0.30,-1.957%,1060771949.00,,2024,130174,,
KBH,KB Home Common Stock,$62.88,-0.15,-0.238%,4278995570.00,United States,1986,1424161,Consumer Discretionary,Homebuilding
KBR,KBR Inc. Common Stock,$49.60,-0.23,-0.462%,6390545146.00,United States,2006,1135411,Industrials,Military/Government/Technical
KBSX,FST Corp. Ordinary Shares,$1.67,0.00,0.00%,63041466.00,Taiwan,,9086,Consumer Discretionary,Recreational Games/Products/Toys
KC,Kingsoft Cloud Holdings Limited American Depositary Shares,$13.58,0.32,2.413%,3696281168.00,China,2020,1097505,Technology,Computer Software: Prepackaged Software
KCHV,Kochav Defense Acquisition Corp. Class A Ordinary Shares,$10.02,0.00,0.00%,0.00,United States,2025,14617,,
KCHVU,Kochav Defense Acquisition Corp. Units,$10.20,0.00,0.00%,0.00,United States,2025,19,,
KD,Kyndryl Holdings Inc. Common Stock,$29.98,-0.11,-0.366%,6929696161.00,United States,2021,3305088,Technology,EDP Services
KDP,Keurig Dr Pepper Inc. Common Stock,$34.78,0.15,0.433%,47246379004.00,United States,,6248210,Consumer Staples,Beverages (Production/Distribution)
KE,Kimball Electronics Inc. Common Stock,$25.82,1.11,4.492%,629501773.00,United States,,733776,Technology,Electrical Products
KELYA,Kelly Services Inc. Class A Common Stock,$14.03,-0.08,-0.567%,494582544.00,United States,,420182,Consumer Discretionary,Professional Services
KELYB,Kelly Services Inc. Class B Common Stock,$13.92,-0.19,-1.347%,490704847.00,United States,,3308,Consumer Discretionary,Professional Services
KEN,Kenon Holdings Ltd. Ordinary Shares,$45.04,0.10,0.223%,2348846900.00,Singapore,2015,10963,Utilities,Electric Utilities: Central
KEP,Korea Electric Power Corporation Common Stock,$13.89,0.14,1.018%,17833762059.00,South Korea,1994,406364,Utilities,Electric Utilities: Central
KEQU,Kewaunee Scientific Corporation Common Stock,$54.06,-2.44,-4.319%,153762317.00,United States,,11742,Industrials,Medical Specialities
KEX,Kirby Corporation Common Stock,$96.50,-1.42,-1.45%,5384700000.00,United States,,423569,Consumer Discretionary,Marine Transportation
KEY,KeyCorp Common Stock,$18.04,-0.26,-1.421%,19781145736.00,United States,,23015212,Finance,Major Banks
KEY^I,KeyCorp Depositary Shares Each Representing a 1/40th Ownership Interest in a Share of Fixed-to-Floating Rate Perpetual Non-Cumulative Preferred Stock Series E,$24.90,0.03,0.121%,,United States,,18421,,
KEY^J,KeyCorp Depositary Shares each representing a 1/40th ownership interest in a share of Fixed Rate Perpetual Non-Cumulative Preferred Stock Series F,$22.50,0.01,0.044%,,United States,,7776,,
KEY^K,KeyCorp Depositary Shares each representing a 1/40th ownership interest in a share of Fixed Rate Perpetual Non-Cumulative Preferred Stock Series G,$22.61,0.04,0.177%,,United States,,10512,,
KEY^L,KeyCorp Depositary Shares each representing a 1/40th ownership interest in a share of Fixed Rate Perpetual Non-Cumulative Preferred Stock Series H,$24.98,0.04,0.16%,,United States,,30054,,
KEYS,Keysight Technologies Inc. Common Stock,$163.40,-1.08,-0.657%,28122587561.00,United States,2014,1061160,Industrials,Industrial Machinery/Components
KF,Korea Fund Inc. (The) New Common Stock,$27.8672,-0.1028,-0.368%,0.00,United States,,3229,Finance,Investment Managers
KFFB,Kentucky First Federal Bancorp Common Stock,$3.20,0.00,0.00%,25877488.00,United States,2005,888,Finance,Savings Institutions
KFII,K&F Growth Acquisition Corp. II Class A Ordinary shares,$10.18,0.00,0.00%,0.00,United States,2025,26136,,
KFIIR,K&F Growth Acquisition Corp. II Rights,$0.15,0.00,0.00%,0.00,United States,2025,133,,
KFRC,Kforce Inc. Common Stock,$32.25,0.00,0.00%,599817750.00,United States,1995,277421,Consumer Discretionary,Professional Services
KFS,Kingsway Financial Services Inc. Common Stock (DE),$13.92,0.21,1.532%,401917937.00,Canada,,32225,Finance,Property-Casualty Insurers
KFY,Korn Ferry Common Stock,$72.46,-0.79,-1.078%,3762195660.00,United States,1999,234164,Consumer Discretionary,Diversified Commercial Services
KG,Kestrel Group Ltd.,$27.47,-2.23,-7.508%,213931223.00,Bermuda,2008,19343,Finance,Property-Casualty Insurers
KGC,Kinross Gold Corporation Common Stock,$19.33,0.44,2.329%,23714044000.00,Canada,2001,18019072,Basic Materials,Precious Metals
KGEI,Kolibri Global Energy Inc. Common stock,$5.69,0.04,0.708%,202498394.00,United States,,88909,Energy,Oil & Gas Production
KGS,Kodiak Gas Services Inc. Common Stock,$34.84,-0.28,-0.797%,3057288390.00,United States,2023,1274740,Utilities,Natural Gas Distribution
KHC,The Kraft Heinz Company Common Stock,$27.67,0.02,0.072%,32750190279.00,United States,,8134804,Consumer Staples,Packaged Foods
KIDS,OrthoPediatrics Corp. Common Stock,$19.19,0.06,0.314%,481162422.00,United States,2017,101235,Health Care,Medical/Dental Instruments
KIDZ,Classover Holdings Inc. Class B Common Stock,$1.30,-0.02,-1.515%,30795873.00,United States,,220361,Real Estate,Other Consumer Services
KIDZW,Classover Holdings Inc. Warrants,$0.0899,0.0024,2.743%,2129653.00,United States,,10953,Real Estate,Other Consumer Services
KIM,Kimco Realty Corporation (HC) Common Stock,$21.21,0.05,0.236%,14363422117.00,United States,,3209031,Real Estate,Real Estate Investment Trusts
KIM^L,Kimco Realty Corporation Class L Depositary Shares each of which represents a one-one thousandth fractional interest in a share of 5.125% Class L Cumulative Redeemable Preferred Stock liquidation preference $25000.00 per share,$21.06,0.01,0.048%,,United States,,4935,,
KIM^M,Kimco Realty Corporation Class M Depositary Shares each of which represents a one-one thousandth fractional interest in a share of 5.25% Class M Cumulative Redeemable Preferred Stock liquidation preference $25000.00 per share,$21.3012,0.0212,0.10%,,United States,,5087,,
KIM^N,Kimco Realty Corporation Depositary Shares each representing 1/1000th interest in a share of 7.25% Class N Cumulative Convertible Perpetual Preferred Stock,$61.49,1.495,2.492%,,United States,,103,,
KINS,Kingstone Companies Inc. Common Stock,$13.98,-0.97,-6.488%,195801042.00,United States,,388922,Finance,Property-Casualty Insurers
KIO,KKR Income Opportunities Fund Common Shares,$12.54,-0.02,-0.159%,0.00,United States,2013,347560,Finance,Investment Managers
KITT,Nauticus Robotics Inc. Common stock,$0.8609,-0.0221,-2.503%,36388214.00,United States,2021,823899,Industrials,Industrial Machinery/Components
KITTW,Nauticus Robotics Inc. Warrant,$0.0655,-0.0036,-5.21%,2768531.00,United States,2021,9422,Industrials,Industrial Machinery/Components
KKR,KKR & Co. Inc. Common Stock,$142.28,-3.78,-2.588%,126764184593.00,United States,,2943624,Finance,Investment Managers
KKR^D,KKR & Co. Inc. 6.25% Series D Mandatory Convertible Preferred Stock,$55.71,-1.95,-3.382%,,United States,,45667,,
KKRS,KKR Group Finance Co. IX LLC 4.625% Subordinated Notes due 2061,$18.10,-0.06,-0.33%,16126171923.00,United States,2021,33025,,
KKRT,KKR & Co. Inc. 6.875% Subordinated Notes due 2065,$25.84,-0.12,-0.462%,0.00,United States,2025,37656,Finance,Investment Managers
KLAC,KLA Corporation Common Stock,$874.94,-80.47,-8.423%,115458281068.00,United States,1980,2063364,Technology,Electronic Components
KLC,KinderCare Learning Companies Inc. Common Stock,$7.50,0.11,1.488%,885923243.00,United States,2024,1964975,Consumer Discretionary,Other Consumer Services
KLG,WK Kellogg Co Common Stock,$23.03,0.00,0.00%,1990169554.00,United States,2023,958263,Consumer Staples,Packaged Foods
KLIC,Kulicke and Soffa Industries Inc. Common Stock,$36.11,-1.29,-3.449%,1882974944.00,Singapore,,415041,Technology,Semiconductors
KLRS,Kalaris Therapeutics Inc. Common Stock,$2.46,0.19,8.37%,46007948.00,United States,2020,78601,Health Care,Biotechnology: Biological Products (No Diagnostic Substances)
KLTO,Klotho Neurosciences Inc. Common Stock,$0.8601,0.0811,10.411%,27948424.00,United States,2022,2311129,Health Care,Biotechnology: Biological Products (No Diagnostic Substances)
KLTOW,Klotho Neurosciences Inc. Warrant,$0.1549,0.0048,3.198%,5033381.00,United States,2022,14359,Health Care,Biotechnology: Biological Products (No Diagnostic Substances)
KLTR,Kaltura Inc. Common Stock,$1.47,-0.04,-2.649%,227102498.00,United States,2021,194497,Technology,Computer Software: Prepackaged Software
KLXE,KLX Energy Services Holdings Inc. Common Stock,$1.83,-0.04,-2.139%,32648036.00,United States,,177781,Energy,Oilfield Services/Equipment
KMB,Kimberly-Clark Corporation Common Stock,$132.94,-0.45,-0.337%,44106824958.00,United States,,2123753,Consumer Discretionary,Containers/Packaging
KMDA,Kamada Ltd. Ordinary Shares,$7.35,0.05,0.685%,422661978.00,Israel,2013,25607,Health Care,Biotechnology: Pharmaceutical Preparations
KMI,Kinder Morgan Inc. Common Stock,$26.67,-0.18,-0.67%,59262810019.00,United States,2011,13657284,Utilities,Natural Gas Distribution
KMPB,Kemper Corporation 5.875% Fixed-Rate Reset Junior Subordinated Debentures due 2062,$23.70,0.00,0.00%,1487003910.00,United States,2022,19515,Finance,Property-Casualty Insurers
KMPR,Kemper Corporation,$53.18,-0.93,-1.719%,3336661094.00,United States,,927082,Finance,Property-Casualty Insurers
KMRK,K-Tech Solutions Company Limited Class A Ordinary Shares,$1.35,-0.08,-5.594%,29025000.00,Hong Kong,2025,77997,Consumer Discretionary,Recreational Games/Products/Toys
KMT,Kennametal Inc. Common Stock,$21.02,-0.18,-0.849%,1597973549.00,United States,,1494181,Industrials,Industrial Machinery/Components
KMTS,Kestra Medical Technologies Ltd. Common Stock,$16.05,0.09,0.564%,824145929.00,United States,2025,96400,Health Care,Medical/Dental Instruments
KMX,CarMax Inc,$57.76,-0.38,-0.654%,8668167500.00,United States,,2382314,Consumer Discretionary,Retail-Auto Dealers and Gas Stations
KN,Knowles Corporation Common Stock,$20.30,-0.35,-1.695%,1743518402.00,United States,2014,616782,Consumer Staples,Consumer Electronics/Appliances
KNDI,Kandi Technologies Group Inc. Ordinary Shares,$1.28,0.01,0.787%,111818540.00,China,,135605,Industrials,Auto Manufacturing
KNF,Knife Riv Holding Co. Common Stock,$89.99,-1.01,-1.11%,5099208208.00,United States,2023,640562,Industrials,Mining & Quarrying of Nonmetallic Minerals (No Fuels)
KNOP,KNOT Offshore Partners LP Common Units representing Limited Partner Interests,$7.25,-0.18,-2.423%,246826837.00,United Kingdom,2013,37608,Consumer Discretionary,Marine Transportation
KNSA,Kiniksa Pharmaceuticals International plc Class A Ordinary Shares,$33.38,0.10,0.30%,2473713958.00,United States,2018,588646,Health Care,Biotechnology: Pharmaceutical Preparations
KNSL,Kinsale Capital Group Inc. Common Stock,$441.84,-11.84,-2.61%,10294872442.00,United States,,245995,Finance,Property-Casualty Insurers
KNTK,Kinetik Holdings Inc. Class A Common Stock,$40.82,-0.10,-0.244%,6610069016.00,United States,2022,656555,Utilities,Natural Gas Distribution
KNX,Knight-Swift Transportation Holdings Inc.,$42.50,-0.56,-1.301%,6897835000.00,United States,2017,1710699,Industrials,Trucking Freight/Courier Services
KO,Coca-Cola Company (The) Common Stock,$69.92,0.37,0.532%,300912414260.00,United States,,12369633,Consumer Staples,Beverages (Production/Distribution)
KOD,Kodiak Sciences Inc Common Stock,$10.57,0.53,5.279%,558325253.00,United States,2018,1594037,Health Care,Biotechnology: Biological Products (No Diagnostic Substances)
KODK,Eastman Kodak Company Common New,$6.24,0.41,7.033%,505440000.00,United States,,3511450,Consumer Discretionary,Industrial Machinery/Components
KOF,Coca Cola Femsa S.A.B. de C.V.  American Depositary Shares each representing 10 Units (each Unit consists of 3 Series B Shares and 5 Series L Shares),$84.12,0.57,0.682%,17672200971.00,Mexico,1993,135261,Consumer Staples,Beverages (Production/Distribution)
KOP,Koppers Holdings Inc. Common Stock,$29.61,-1.03,-3.362%,583776754.00,United States,2006,223009,Basic Materials,Forest Products
KOPN,Kopin Corporation Common Stock,$1.97,0.06,3.141%,320727528.00,United States,1992,2766990,Technology,Semiconductors
KORE,KORE Group Holdings Inc. Common Stock,$2.28,-0.15,-6.173%,39124939.00,United States,,17389,Telecommunications,Telecommunications Equipment
KOS,Kosmos Energy Ltd. Common Shares (DE),$1.70,-0.04,-2.299%,813031752.00,Bermuda,2011,7397861,Energy,Oil & Gas Production
KOSS,Koss Corporation Common Stock,$5.69,0.22,4.022%,53348274.00,United States,,66355,Consumer Staples,Consumer Electronics/Appliances
KPLT,Katapult Holdings Inc. Common Stock,$14.05,0.89,6.763%,64202121.00,United States,2019,49383,Consumer Discretionary,Diversified Commercial Services
KPLTW,Katapult Holdings Inc. Warrant,$0.0124,0.0002,1.639%,56662.00,United States,2019,81172,Consumer Discretionary,Diversified Commercial Services
KPRX,Kiora Pharmaceuticals Inc.  Common Stock,$2.93,0.40,15.81%,10060129.00,United States,,380472,Health Care,Biotechnology: Pharmaceutical Preparations
KPTI,Karyopharm Therapeutics Inc. Common Stock,$5.92,1.27,27.312%,51333966.00,United States,2013,1622358,Health Care,Biotechnology: Pharmaceutical Preparations
KR,Kroger Company (The) Common Stock,$69.69,0.46,0.664%,46075950350.00,United States,,4419464,Consumer Staples,Food Chains
KRC,Kilroy Realty Corporation Common Stock,$38.71,0.38,0.991%,4579173437.00,United States,1997,1325566,Real Estate,Real Estate Investment Trusts
KREF,KKR Real Estate Finance Trust Inc. Common Stock,$9.23,-0.05,-0.539%,606190698.00,United States,2017,605742,Real Estate,Real Estate Investment Trusts
KREF^A,KKR Real Estate Finance Trust Inc. 6.50% Series A Cumulative Redeemable Preferred Stock,$21.044,-0.156,-0.736%,,United States,,3446,,
KRG,Kite Realty Group Trust Common Stock,$21.51,0.07,0.326%,4729149731.00,United States,2004,1040012,Real Estate,Real Estate Investment Trusts
KRKR,36Kr Holdings Inc. American Depositary Shares,$4.70,-0.23,-4.665%,185252582.00,China,2019,1434,Real Estate,Real Estate
KRMD,KORU Medical Systems Inc. Common Stock (DE),$4.17,0.05,1.214%,192799771.00,United States,,78341,Health Care,Medical/Dental Instruments
KRMN,Karman Holdings Inc. Common Stock,$50.60,-0.31,-0.609%,6695515211.00,,2025,784668,Industrials,Military/Government/Technical
KRNT,Kornit Digital Ltd. Ordinary Shares,$15.00,-0.41,-2.661%,679912545.00,Israel,2015,252484,Industrials,Industrial Machinery/Components
KRNY,Kearny Financial Corp Common Stock,$6.04,-0.16,-2.581%,390061285.00,United States,2005,473061,Finance,Savings Institutions
KRO,Kronos Worldwide Inc Common Stock,$6.01,-0.15,-2.435%,691469227.00,United States,,523960,Basic Materials,Major Chemicals
KROS,Keros Therapeutics Inc. Common Stock,$14.48,0.06,0.416%,588111195.00,United States,2020,383521,Health Care,Biotechnology: Pharmaceutical Preparations
KRP,Kimbell Royalty Partners Common Units Representing Limited Partner Interests,$14.34,-0.11,-0.761%,1547114322.00,United States,2017,417596,Energy,Oil & Gas Production
KRRO,Korro Bio Inc. Common Stock,$20.26,0.38,1.911%,190259695.00,United States,2019,136829,Health Care,Biotechnology: Pharmaceutical Preparations
KRT,Karat Packaging Inc. Common Stock,$25.35,-0.09,-0.354%,509351339.00,United States,2021,125092,Industrials,Plastic Products
KRUS,Kura Sushi USA Inc. Class A Common Stock,$77.23,-0.80,-1.025%,934014909.00,United States,2019,239157,Consumer Discretionary,Restaurants
KRYS,Krystal Biotech Inc. Common Stock,$150.27,-0.06,-0.04%,4349261755.00,United States,2017,238579,Health Care,Biotechnology: Biological Products (No Diagnostic Substances)
KSCP,Knightscope Inc. Class A Common Stock,$5.56,-0.20,-3.472%,56618253.00,United States,2022,230798,Telecommunications,Telecommunications Equipment
KSPI,Joint Stock Company Kaspi.kz American Depository Shares,$95.24,-0.67,-0.699%,18032119207.00,Kazakhstan,2024,204847,,
KSS,Kohl's Corporation Common Stock,$13.77,-0.69,-4.772%,1542813920.00,United States,1992,7284057,Consumer Discretionary,Department/Specialty Retail Stores
KT,KT Corporation Common Stock,$20.59,-0.11,-0.531%,10123400716.00,South Korea,,712320,Telecommunications,Telecommunications Equipment
KTB,Kontoor Brands Inc. Common Stock ,$70.90,0.93,1.329%,3940213191.00,United States,2019,665506,Industrials,Garments and Clothing
KTCC,Key Tronic Corporation Common Stock,$2.78,-0.01,-0.358%,29918001.00,United States,1983,6840,Technology,Electrical Products
KTF,DWS Municipal Income Trust,$8.62,-0.0099,-0.115%,340498086.00,United States,1988,116334,Finance,Finance Companies
KTH,Structures Products Cp 8% CorTS Issued by Peco Energy Cap Tr II Preferred Stock,$28.70,0.0128,0.045%,0.00,United States,,2113,Finance,Finance: Consumer Services
KTN,Structured Products Corp 8.205% CorTS 8.205% Corporate Backed Trust Securities (CorTS),$26.08,-0.01,-0.038%,0.00,United States,,457,Finance,Finance: Consumer Services
KTOS,Kratos Defense & Security Solutions Inc. Common Stock,$68.50,-0.62,-0.897%,11562423250.00,United States,,2866966,Industrials,Military/Government/Technical
KTTA,Pasithea Therapeutics Corp. Common Stock,$0.7027,0.00,0.00%,5230602.00,United States,2021,36617,Health Care,Biotechnology: Pharmaceutical Preparations
KTTAW,Pasithea Therapeutics Corp. Warrant,$0.0199,0.00,0.00%,148127.00,United States,2021,825,Health Care,Biotechnology: Pharmaceutical Preparations
KUKE,Kuke Music Holding Limited American Depositary Shares (each representing ten (10) Class A Ordinary Shares),$1.7461,0.0261,1.517%,35488251.00,,,10345,Real Estate,Other Consumer Services
KULR,KULR Technology Group Inc. Common Stock,$5.25,-0.02,-0.38%,202643438.00,United States,,8998022,Technology,Electrical Products
KURA,Kura Oncology Inc. Common Stock,$7.34,0.74,11.212%,637091338.00,United States,,4321642,Health Care,Biotechnology: Pharmaceutical Preparations
KVAC,Keen Vision Acquisition Corporation Ordinary Shares,$11.45,0.00,0.00%,0.00,United States,2023,3040,,
KVHI,KVH Industries Inc. Common Stock,$5.36,-0.09,-1.651%,104545535.00,United States,1996,18250,Technology,Radio And Television Broadcasting And Communications Equipment
KVUE,Kenvue Inc. Common Stock,$21.20,0.14,0.665%,40684282304.00,United States,2023,16053998,Consumer Discretionary,Specialty Chemicals
KVYO,Klaviyo Inc. Series A Common Stock,$31.43,0.40,1.289%,9428508655.00,United States,2023,2355314,Technology,Computer Software: Prepackaged Software
KW,Kennedy-Wilson Holdings Inc. Common Stock,$8.09,-0.12,-1.462%,1115609342.00,United States,,682310,Finance,Real Estate
KWM,K Wave Media Ltd. Ordinary Shares,$2.64,0.04,1.538%,166747680.00,Cayman Islands,,173782,Consumer Discretionary,Movies/Entertainment
KWMWW,K Wave Media Ltd. Warrant,$0.1422,0.0022,1.571%,8981636.00,Cayman Islands,,20086,Consumer Discretionary,Movies/Entertainment
KWR,Quaker Houghton Common Stock,$135.40,-0.81,-0.595%,2355231413.00,United States,,82765,Industrials,Major Chemicals
KXIN,Kaixin Holdings Ordinary Shares,$0.7001,-0.0013,-0.185%,7668423.00,China,2017,68443,Consumer Discretionary,Retail-Auto Dealers and Gas Stations
KYIV,Kyivstar Group Ltd. Common Shares,$11.52,-0.92,-7.395%,0.00,United Arab Emirates,,1729467,,
KYIVW,Kyivstar Group Ltd. Warrant,$3.71,0.60,19.293%,0.00,United Arab Emirates,,145907,,
KYMR,Kymera Therapeutics Inc. Common Stock,$42.63,1.08,2.599%,3047942560.00,United States,2020,824527,Health Care,Biotechnology: Biological Products (No Diagnostic Substances)
KYN,Kayne Anderson Energy Infrastructure Fund Inc.,$12.14,-0.22,-1.78%,1652636774.00,United States,2004,373711,Finance,Finance/Investors Services
KYTX,Kyverna Therapeutics Inc. Common Stock,$3.51,-0.03,-0.847%,151792291.00,United States,2024,284730,Health Care,Biotechnology: Biological Products (No Diagnostic Substances)
KZIA,Kazia Therapeutics Limited American Depositary Shares,$8.035,-0.235,-2.842%,10924587.00,Australia,,10312,Health Care,Biotechnology: Pharmaceutical Preparations
KZR,Kezar Life Sciences Inc. Common Stock,$3.97,-0.01,-0.251%,29072731.00,United States,2018,42565,Health Care,Biotechnology: Pharmaceutical Preparations
L,Loews Corporation Common Stock,$95.00,-0.58,-0.607%,19705507525.00,United States,,947329,Finance,Property-Casualty Insurers
LAB,Standard BioTools Inc. Common Stock,$1.23,0.01,0.82%,467181390.00,United States,2011,1009578,Industrials,Biotechnology: Laboratory Analytical Instruments
LAC,Lithium Americas Corp. Common Shares,$2.90,0.04,1.399%,634190740.00,Canada,2023,6184034,Basic Materials,Metal Mining
LAD,Lithia Motors Inc. Common Stock,$300.88,-7.22,-2.343%,7713495377.00,United States,,321198,Consumer Discretionary,Retail-Auto Dealers and Gas Stations
LADR,Ladder Capital Corp Class A Common Stock,$11.17,-0.06,-0.534%,1423739102.00,United States,2014,439658,Real Estate,Real Estate Investment Trusts
LAES,SEALSQ Corp Ordinary Shares,$2.76,-0.14,-4.828%,288444567.00,Switzerland,,4409965,Technology,Semiconductors
LAKE,Lakeland Industries Inc. Common Stock,$14.97,0.02,0.134%,142433547.00,United States,1986,149250,Health Care,Industrial Specialties
LAMR,Lamar Advertising Company Class A Common Stock,$123.27,2.05,1.691%,12477227793.00,United States,1996,1583337,Real Estate,Real Estate Investment Trusts
LAND,Gladstone Land Corporation Common Stock,$8.88,0.04,0.452%,321319763.00,United States,2013,363195,Real Estate,Real Estate Investment Trusts
LANDM,Gladstone Land Corporation 5.00% Series D Cumulative Term Preferred Stock,$24.94,0.09,0.362%,902445371.00,United States,,21710,Real Estate,Real Estate Investment Trusts
LANDO,Gladstone Land Corporation 6.00% Series B Cumulative Redeemable Preferred Stock,$19.2911,-0.0189,-0.098%,698041856.00,United States,,15907,Real Estate,Real Estate Investment Trusts
LANDP,Gladstone Land Corporation 6.00% Series C Cumulative Redeemable Preferred Stock,$19.2999,0.0199,0.103%,698360281.00,United States,,20230,Real Estate,Real Estate Investment Trusts
LANV,Lanvin Group Holdings Limited Ordinary Shares,$2.253,-0.077,-3.305%,314914886.00,Cayman Islands,2022,36967,Consumer Discretionary,Apparel
LAR,Lithium Argentina AG Common Shares,$3.32,-0.05,-1.484%,538836000.00,Canada,2023,1063946,Basic Materials,Metal Mining
LARK,Landmark Bancorp Inc. Common Stock,$26.03,-0.07,-0.268%,150539611.00,United States,,7598,Finance,Major Banks
LASE,Laser Photonics Corporation Common Stock,$2.53,-0.015,-0.589%,36118660.00,United States,2022,92193,Miscellaneous,Industrial Machinery/Components
LASR,nLIGHT Inc. Common Stock,$26.18,-0.07,-0.267%,1306367889.00,United States,2018,901852,Technology,Semiconductors
LAUR,Laureate Education Inc. Common Stock,$25.91,0.11,0.426%,3818177584.00,United States,2017,685823,Real Estate,Other Consumer Services
LAW,CS Disco Inc. Common Stock,$4.90,0.05,1.031%,302535045.00,United States,2021,78514,Technology,Computer Software: Prepackaged Software
LAWR,Robot Consulting Co. Ltd. ADS,$1.69,-0.07,-3.977%,75559900.00,Japan,2025,535812,Technology,Computer Software: Programming Data Processing
LAZ,Lazard Inc. Common Stock,$54.01,-1.31,-2.368%,6090496575.00,Bermuda,2005,530275,Finance,Investment Managers
LAZR,Luminar Technologies Inc.  Class A Common Stock,$2.30,-0.16,-6.504%,158158253.00,United States,2019,5544650,Consumer Discretionary,Auto Parts:O.E.M.
LB,LandBridge Company LLC Class A Shares Representing Limited Liability Company Interests,$51.51,-2.12,-3.953%,3943117285.00,,2024,778856,Energy,Oil & Gas Production
LBGJ,Li Bang International Corporation Inc. Ordinary Shares,$1.19,0.04,3.478%,22038800.00,China,2024,8316,,
